{
  "$comment": [
    "GENERATED by scripts/steps/_schema/generate-template-freeze.mjs — do not hand-edit.",
    "Spec 122 §8.2 (\"freeze the template after the eighth, never the first\") as a declared",
    "artifact + a both-directions gate (src/tests/template-freeze.infra.test.ts, the R-E lock).",
    "frozen_after_pilot/lg21_decision/does_not_freeze are DECLARED rulings (edit the generator",
    "constants + Spec 122 §8, same commit). frozen_at/schema_sha256/categories/",
    "archetype_profiles/phase_runners are the FROZEN tier — re-derived ONLY by `--refresh`",
    "(a deliberate re-freeze), never by a plain regenerate, so a schema edit cannot silently",
    "launder itself into the new baseline. batching_prereq_snapshot is the LIVE tier —",
    "re-derived on every regenerate, `--check` included.",
    "Regenerate with `node scripts/steps/_schema/generate-template-freeze.mjs` (frozen tier",
    "preserved, live tier refreshed) or `--refresh` (frozen tier re-derived, frozen_at := HEAD)."
  ],
  "contract_version": 1,
  "frozen_at": "31ab81f87495ceb22cbe64c3408eab29488879dd",
  "frozen_after_pilot": 9,
  "schema_sha256": "73ddc02459be7c39b371cd5f0a31ac017f9640c0930a5fe628456670eb33b4df",
  "categories": [
    "identity",
    "inputs",
    "outputs",
    "staleness",
    "guards",
    "execution",
    "checks",
    "invariants",
    "plausibility",
    "override",
    "emits",
    "deviations",
    "limitations",
    "interpretation",
    "recovery",
    "database",
    "counters",
    "config",
    "sharing",
    "terminals"
  ],
  "archetype_profiles": [
    {
      "archetype": "INGESTOR",
      "shapes": [
        "ingest"
      ],
      "runners": [
        "runIngestPhase"
      ],
      "first_step": "load_ravines",
      "proven": true
    },
    {
      "archetype": "MATERIALIZER",
      "shapes": [
        "materialize"
      ],
      "runners": [
        "runMaterializePhase"
      ],
      "first_step": "link_parcel_addresses",
      "proven": true
    },
    {
      "archetype": "LINK",
      "shapes": [
        "link",
        "link_keyed",
        "link_column"
      ],
      "runners": [
        "runLinkPhase",
        "runLinkKeyedPhase",
        "runLinkColumnPhase"
      ],
      "first_step": "link_massing",
      "proven": true
    },
    {
      "archetype": "MATCHER",
      "shapes": [
        "cascade"
      ],
      "runners": [
        "runCascadePhase"
      ],
      "first_step": "link_wsib",
      "proven": true
    },
    {
      "archetype": "ENRICHER",
      "shapes": [
        "enrich"
      ],
      "runners": [
        "runEnrichPhase"
      ],
      "first_step": "enrich_parcels",
      "proven": true
    },
    {
      "archetype": "BACKFILL",
      "shapes": [
        "backfill"
      ],
      "runners": [
        "runBackfillPhase"
      ],
      "first_step": "compute_centroids",
      "proven": true
    },
    {
      "archetype": "ASSERT",
      "shapes": [],
      "runners": [],
      "first_step": "assert_schema",
      "proven": true
    },
    {
      "archetype": "RECORDER",
      "shapes": [
        "recorder"
      ],
      "runners": [
        "runRecorderPhase"
      ],
      "first_step": "refresh_snapshot",
      "proven": true
    }
  ],
  "phase_runners": [
    {
      "shape": "ingest",
      "runner": "runIngestPhase",
      "phase_order": [
        "acquire.resolveTimeoutMs",
        "staleness.resolveOverrides",
        "staleness.detectInterruptedRetraction",
        "write.buildWritePlan",
        "staleness.priorRunErrorPosture",
        "staleness.readPriorEmitWithPosture",
        "staleness.declaredChains",
        "write.assertWritePrivileges",
        "acquire.acquireExternal",
        "staleness.preAcquisitionDecision",
        "write.validateGeometries",
        "preWriteGate",
        "write.executeStagingReplace",
        "write.executeWrite"
      ]
    },
    {
      "shape": "link",
      "runner": "runLinkPhase",
      "phase_order": [
        "staleness.readPriorEmit",
        "staleness.declaredChains",
        "staleness.resolveOverrides",
        "write.assertWritePrivileges",
        "write.buildWritePlan",
        "write.targetKey",
        "preWriteGate",
        "write.retractionFires",
        "pipeline.withTransaction",
        "write.writeBeforeImage",
        "write.executeRetraction"
      ]
    },
    {
      "shape": "link_column",
      "runner": "runLinkColumnPhase",
      "phase_order": [
        "staleness.resolveOverrides",
        "write.assertWritePrivileges",
        "staleness.priorRunErrorPosture",
        "staleness.readPriorEmitWithPosture",
        "staleness.declaredChains",
        "write.buildWritePlan",
        "write.targetKey",
        "preWriteGate",
        "write.executeSetBasedJoinUpdate"
      ]
    },
    {
      "shape": "link_keyed",
      "runner": "runLinkKeyedPhase",
      "phase_order": [
        "staleness.readPriorEmit",
        "staleness.declaredChains",
        "staleness.resolveOverrides",
        "write.assertWritePrivileges",
        "write.buildWritePlan",
        "write.targetKey",
        "preWriteGate",
        "write.retractionFires",
        "pipeline.withTransaction",
        "write.writeBeforeImage",
        "write.executeRetraction",
        "write.executeUpsertBatch",
        "write.persistBeforeImageRows",
        "write.executeGuardedDeleteByKey",
        "write.executeGuardedUpdate"
      ]
    },
    {
      "shape": "cascade",
      "runner": "runCascadePhase",
      "phase_order": [
        "staleness.resolveOverrides",
        "staleness.detectInterruptedRetraction",
        "staleness.ledgerGatedSkip",
        "staleness.readPriorEmit",
        "staleness.declaredChains",
        "staleness.triggersAt",
        "staleness.measureTrigger",
        "write.assertWritePrivileges",
        "write.buildWritePlan",
        "write.targetKey",
        "pipeline.withTransaction",
        "preWriteGate",
        "write.persistBeforeImageRows",
        "write.executeSetBasedJoinUpdate",
        "write.executeSetBasedClear"
      ]
    },
    {
      "shape": "materialize",
      "runner": "runMaterializePhase",
      "phase_order": [
        "staleness.resolveOverrides",
        "staleness.detectInterruptedRetraction",
        "staleness.ledgerGatedSkip",
        "staleness.readPriorEmit",
        "staleness.declaredChains",
        "write.assertWritePrivileges",
        "write.buildWritePlan",
        "write.targetKey",
        "preWriteGate",
        "pipeline.withTransaction",
        "write.executeInsertSelectNoRetract"
      ]
    },
    {
      "shape": "backfill",
      "runner": "runBackfillPhase",
      "phase_order": [
        "staleness.resolveOverrides",
        "write.assertWritePrivileges",
        "staleness.readPriorEmit",
        "staleness.declaredChains",
        "write.buildWritePlan",
        "write.targetKey",
        "preWriteGate",
        "write.executeBackfillUpdate"
      ]
    },
    {
      "shape": "recorder",
      "runner": "runRecorderPhase",
      "phase_order": [
        "staleness.resolveOverrides",
        "write.assertWritePrivileges",
        "staleness.readPriorEmit",
        "staleness.declaredChains",
        "write.buildWritePlan",
        "write.targetKey",
        "preWriteGate",
        "pipeline.withTransaction",
        "write.executeRecorderUpsert"
      ]
    },
    {
      "shape": "enrich",
      "runner": "runEnrichPhase",
      "phase_order": [
        "staleness.resolveOverrides",
        "staleness.detectInterruptedRetraction",
        "write.assertWritePrivileges",
        "staleness.readPriorEmit",
        "staleness.declaredChains",
        "write.targetKey",
        "preWriteGate",
        "write.buildWritePlan",
        "write.writeBeforeImage",
        "write.executeSetBasedClear",
        "write.executeSetBasedJoinUpdate",
        "pipeline.withTransaction"
      ]
    }
  ],
  "lg21_decision": {
    "ruling": "fork-over-share RATIFIED",
    "reasons": [
      "pilot 4 forked runCascadePhase because a tiers[] branch inside runLinkPhase would split its keyset loop",
      "pilot 5 forked runMaterializePhase because runLinkPhase's SELECT-then-batch write would split a single server-side statement and break G2's verbatim-SQL guarantee",
      "pilot 6 deferred a shared runPhaseScaffold a 3rd time (Fold D)",
      "pilot 7 forked runLinkKeyedPhase leaving runLinkPhase byte-for-byte untouched (245 lines) — Spec 124 §9 :306-310",
      "consolidating the 7 runners AT the freeze commit would rewrite all of them in the one commit that promises they stop changing — the exact inversion of \"enforcement must be harder to change than the enforced\" (§10b.1)"
    ],
    "superseded_items": [
      "LG-21"
    ]
  },
  "batching_prereq_snapshot": [],
  "does_not_freeze": [
    "Library internals — runner bodies, helper extraction, perf work inside scripts/lib/step/** — only the phase ORDER per shape and the shape enum are frozen.",
    "Compute — scripts/lib/compute/<slug>.js is per-step logic, never template surface.",
    "Descriptor VALUES — every converted step keeps editing its own checks[]/invariants[]/plausibility[]/thresholds/config.logic_variables[] freely (Spec 123 §5's 55 PER_STEP claims; the freeze governs the 235 UNIVERSAL ones).",
    "converted.json / programme-items.json / grandfathered.json / schema-baseline.json — enforcement-scope registries that must keep growing as steps convert.",
    "Additive fields carrying x-ruling — the G-1 ratchet stays the path for a genuinely new field; the freeze adds the requirement that such a commit ALSO bumps template-freeze.json and amends Spec 122 §8.",
    "Notes/fences, spec prose, review followups."
  ]
}
